{
  "$schema": "https://json-schema.org/draft/2020-12/schema",
  "$id": "https://schemas.bcinexus.xyz/plugin-manifest.schema.json",
  "title": "BCINexus Plugin Manifest",
  "type": "object",
  "required": ["id", "name", "version", "entry", "permissions"],
  "additionalProperties": false,
  "properties": {
    "id": {
      "type": "string",
      "pattern": "^[a-z0-9][a-z0-9._-]*$"
    },
    "name": {
      "type": "string",
      "minLength": 1
    },
    "version": {
      "type": "string",
      "minLength": 1
    },
    "entry": {
      "type": "string",
      "minLength": 1
    },
    "description": {
      "type": "string"
    },
    "permissions": {
      "type": "array",
      "items": {
        "type": "string"
      },
      "uniqueItems": true
    },
    "compatibility": {
      "type": "object",
      "additionalProperties": false,
      "properties": {
        "bcinexus": {
          "type": "string"
        },
        "bcilattice": {
          "type": "string"
        }
      }
    }
  }
}
